religion,title,content,image
B,Accept Yourself and Let Go of Perfectionism,"Happiness grows when you accept yourself with all your strengths and flaws. Buddhist teachings encourage self-acceptance over perfectionism, reducing self-criticism and enhancing well-being by letting you be content with who you are.",img_001.jpg
B,Embrace Impermanence,"Everything in life is constantly changing. By accepting impermanence, you can let go of attachment and learn to appreciate things as they are, even in difficult times. This reduces suffering and fosters a deep sense of gratitude.",img_002.jpg
B,Practice Mindfulness,"Being mindful helps you live in the present moment, freeing you from regrets about the past and anxieties about the future. Regular mindfulness practice allows you to enjoy life’s simple pleasures, experience inner peace, and develop resilience to stress.",img_003.jpg
B,Let Go of Anger and Hatred (Releasing Negative Emotions),"Anger and hatred are sources of suffering and disrupt the mind. Letting go of anger doesn’t mean ignoring injustice, but choosing not to cling to emotions that cause suffering. Releasing negative emotions brings peace and lightness to life.",img_004.jpg
B,The Middle Way,"The Middle Way is a path of moderation, avoiding extremes of indulgence and self-denial. It’s a balanced approach to life that seeks harmony between body and mind, guiding practitioners away from destructive habits and toward sustainable well-being.",img_005.jpg
B,Develop Patience (Khanti),"Patience, or Khanti, is a virtue that brings happiness and tranquility. Practicing patience helps us accept mistakes and obstacles in life without feeling discouraged. Cultivating patience allows us to handle life’s imperfections with a positive outlook.",img_006.jpg
B,Love Yourself (Self-Compassion),"Self-compassion is essential for happiness, and loving oneself isn’t selfish. Practicing self-compassion reduces stress and pressure from self-judgment, allowing us to feel happier and better able to share that happiness with others.",img_007.jpg
B,Observe the Five Precepts,"The Five Precepts are ethical guidelines that help foster peace and happiness. They include refraining from killing, stealing, sexual misconduct, lying, and consuming intoxicants. Following these precepts promotes peace, reduces conflict, and fosters harmony with oneself and others.",img_008.jpg
B,Live Without Judging Others,"Judging others leads to comparison and inner distress. When we refrain from judgment and learn to accept others as they are, we feel happier and more at peace. Accepting others fosters better relationships and inner tranquility.",img_009.jpg
B,Free the Mind from Expectations,"Expectations often lead to suffering. Letting go of expectations and learning to be content with what we have brings freedom and happiness, regardless of life’s circumstances.",img_010.jpg
B,Love Nature and Respect All Beings,"Respecting nature and all living beings fosters a sense of connection to the world. A positive relationship with nature promotes happiness and peace, while also teaching us compassion and appreciation for what nature provides.",img_011.jpg
B,The Four Noble Truths,"The Four Noble Truths are fundamental insights into the nature of human experience. They include the truth of suffering (Dukkha), the origin of suffering (Samudaya), the cessation of suffering (Nirodha), and the path leading to the cessation of suffering (Magga). Recognizing these truths fosters a deeper understanding of life and a way to end the cycle of suffering.",img_012.jpg
C,Love God with All Your Heart,"In Christianity, the greatest commandment is to love God with all your heart, soul, and mind (Matthew 22:37-38). This love establishes a relationship with God, bringing peace, purpose, and spiritual joy.",img_013.jpg
C,Love Your Neighbor as Yourself,"Jesus taught the importance of loving others as you love yourself (Mark 12:31). This love includes showing kindness, forgiveness, and compassion to everyone, leading to harmonious relationships and a heart free from bitterness.",img_014.jpg
C,Practice Forgiveness,"Christianity places high importance on forgiveness, both receiving and giving it (Matthew 6:14-15). Forgiveness releases the weight of anger and resentment, leading to emotional healing and peace.",img_015.jpg
C,Be Humble,"Humility is a central Christian virtue, taught by Jesus through his life and actions (Philippians 2:3-8). Humility allows us to serve others selflessly, reduces conflict, and helps us grow closer to God and others.",img_016.jpg
C,Trust in God’s Plan,"Trusting that God has a plan for our lives, even when things are difficult, brings peace and hope (Jeremiah 29:11). Faith in God’s guidance and love helps us navigate life’s challenges with a sense of assurance.",img_017.jpg
C,Pray Regularly,"Prayer is central in Christianity as a way to communicate with God, express gratitude, seek guidance, and find comfort (Philippians 4:6-7). Regular prayer strengthens faith, brings inner peace, and reminds us of God’s presence.",img_018.jpg
C,Be Grateful in All Circumstances,"Christianity teaches gratitude as a way to recognize God’s blessings, even in challenging times (1 Thessalonians 5:18). Practicing gratitude enhances joy, shifts focus to the positive, and helps us trust in God’s provision.",img_019.jpg
C,Love Your Enemies and Pray for Them,"Jesus taught his followers to love even those who hurt them (Matthew 5:44). Loving and praying for our enemies promotes peace, prevents bitterness, and transforms negative feelings into compassion and understanding.",img_020.jpg